{
  "eventClass": "S-2220",
  "tenantId": "tenant-a",
  "sourceEventId": "source-event-S-2220",
  "sourceEntityId": "source-entity-S-2220",
  "environment": "qualification",
  "employerCnpj": "12345678000199",
  "employeeId": "employee-1",
  "cpf": "12345678901",
  "registration": "MAT-1",
  "kind": "periodic",
  "examDate": "2026-05-03"
}
